{
  "id": "zone-8a-fall",
  "zone": "8a",
  "season": "fall",
  "guidance": "First frost typically mid-November. Ideal window for planting perennial plugs so root systems establish before winter. Leave seed heads standing for pollinator overwintering.",
  "relatedPlants": ["monarda-fistulosa", "asclepias-tuberosa"],
  "version": "1.0.0",
  "updated": "2026-07-12"
}
